identifier,uri,label,url,target,owner,resource_type,registrant,comments,deprecated
OGC:CSW,http://www.opengis.net/def/serviceType/ogc/csw,OGC Catalog Service for the Web,http://www.opengeospatial.org/standards/cat,srv:serviceType;gmd:protocol;usgin:overlayAPI,,service,@tomkralidis,gmd:protocol value that indicates CI_OnlineResource URL is for an OGC Catalog service for the web v2.0.2 endpoint (should use different protocol identifier if the endpoint is not v2.0.2; these are not yet defined here).  The gmd:function value in the CI_Online resource should be 'information' if the provided URL is a getCapabilities request. ,
OGC:SOS,http://www.opengis.net/def/serviceType/ogc/sos,OGC Sensor Observation Service,http://www.opengeospatial.org/standards/sos,srv:serviceType;gmd:protocol;usgin:overlayAPI,,service,@tomkralidis,"gmd:protocol value that indicates CI_OnlineResource URL is for an OGC Sensor Observation service v?? endpoint (should use different protocol identifier if the endpoint is not that version; these are not yet defined here).  The gmd:function value in the CI_Online resource should be 'information' if the provided URL is a getCapabilities request. Note that if the service offers multiple datasets in different offerings, the parameters necessary to access the correct offering should be specified in the gmd:CI_OnlineResource/gmd:description element; recommended practice is to use a JSON object with keys that are parameter names and values that are the necessary parameters.",urn:x-esri:specification:ServiceType:SOS; urn:x-esri:specification:ServiceType:sos:url
OGC:SPS,http://www.opengeospatial.org/standards/sps,OGC Sensor Planning Service,http://www.opengeospatial.org/standards/sps,srv:serviceType;gmd:protocol;usgin:overlayAPI,,service,@pvgenuchten,gmd:protocol value that indicates CI_OnlineResource URL is for an Sensor Planning Service ,
OGC:SAS,http://www.ogcnetwork.net/SAS,OGC Sensor Alert Service,http://www.ogcnetwork.net/SAS,srv:serviceType;gmd:protocol;usgin:overlayAPI,,service,@pvgenuchten,gmd:protocol value that indicates CI_OnlineResource URL is for an Sensor Alert Service,
OGC:WNS,http://www.ogcnetwork.net/WNS,OGC Web Notification Service,http://portal.opengeospatial.org/files/?artifact_id=1367,srv:serviceType;gmd:protocol;usgin:overlayAPI,,service,@pvgenuchten,gmd:protocol value that indicates CI_OnlineResource URL is for an Web Notification Service ,
OGC:WCS,http://www.opengis.net/def/serviceType/ogc/wcs,OGC Web Coverage Service,http://www.opengeospatial.org/standards/wcs,srv:serviceType;gmd:protocol;usgin:overlayAPI,,service,@tomkralidis,"gmd:protocol value that indicates CI_OnlineResource URL is for an OGC Web coverage service v?? endpoint (should use different protocol identifier if the endpoint is not that version; these are not yet defined here).  The gmd:function value in the CI_Online resource should be 'information' if the provided URL is a getCapabilities request. Note that if the service offers multiple datasets in different coverages, the parameters necessary to access the correct coverage should be specified in the gmd:CI_OnlineResource/gmd:description element; recommended practice is to use a JSON object with keys that are parameter names and values that are the necessary parameters.",urn:x-esri:specification:ServiceType:WCS; urn:x-esri:specification:ServiceType:wcs:url
OGC:WFS,http://www.opengis.net/def/serviceType/ogc/wfs,OGC Web Feature Service,http://www.opengeospatial.org/standards/wfs,srv:serviceType;gmd:protocol;usgin:overlayAPI,,service,@tomkralidis,gmd:protocol value that indicates CI_OnlineResource URL is for an OGC Web Feature Service v?? endpoint (should use different protocol identifier if the endpoint is not that version; these are not yet defined here).  The gmd:function value in the CI_Online resource should be 'information' if the provided URL is a getCapabilities request. Note that if the service offers multiple datasets in different feature types the typeName parameter necessary to access the correct data should be specified in the gmd:CI_OnlineResource/gmd:description element; recommended practice is to use a JSON object with keys that are parameter names and values that are the necessary parameters.,urn:x-esri:specification:ServiceType:WFS; urn:x-esri:specification:ServiceType:wfs:url
OGC:WMS,http://www.opengis.net/def/serviceType/ogc/wms,OGC Web Map Service,http://www.opengeospatial.org/standards/wms,srv:serviceType;gmd:protocol;usgin:overlayAPI,,service,@tomkralidis,"gmd:protocol value that indicates CI_OnlineResource URL is for an OGC Web Map Service v?? endpoint (should use different protocol identifier if the endpoint is not that version; these are not yet defined here).  The gmd:function value in the CI_Online resource should be 'information' if the provided URL is a getCapabilities request. Note that if the service offers multiple datasets in different map layers, the layers parameters necessary to access the correct data should be specified in the gmd:CI_OnlineResource/gmd:description element; recommended practice is to use a JSON object with keys that are parameter names and values that are the necessary parameters.",urn:x-esri:specification:ServiceType:WMS; urn:x-esri:specification:ServiceType:wms:url
OGC:WMS-C,http://www.opengis.net/def/serviceType/ogc/wms,OGC Web Map Service - Cached,https://wiki.osgeo.org/wiki/WMS_Tile_Caching,srv:serviceType;gmd:protocol;usgin:overlayAPI,,service,@pacioos,"This is an unofficial profile of WMS using OSGeo recommendations to pull cached map tiles from the server when available. Often this is specified with a 'tiled=true' URL parameter in the GetMap request.", "While WMS-C has been superseded by the OSGeo Tile Map Service specification (TMS) and the OGC Web Map Tile Service standard (WMTS), it is still widely supported."
OGC:WMTS,http://www.opengeospatial.org/standards/wmts,OGC Web Map Tile Service,http://www.opengeospatial.org/standards/wmts,srv:serviceType;gmd:protocol;usgin:overlayAPI,,service,@pvgenuchten,gmd:protocol value that indicates CI_OnlineResource URL is for an OGC Web Map Tile Service,
OGC:WPS,http://www.opengis.net/def/serviceType/ogc/wps,OGC Web Processing Service,http://www.opengeospatial.org/standards/wps,srv:serviceType;gmd:protocol;usgin:overlayAPI,,service,@tomkralidis,gmd:protocol value that indicates CI_OnlineResource URL is for an OGC Web Processing Service v?? endpoint (should use different protocol identifier if the endpoint is not that version; these are not yet defined here).  The gmd:function value in the CI_Online resource should be 'information' if the provided URL is a getCapabilities request. Other parameters necessary to access the correct processing service should be specified in the gmd:CI_OnlineResource/gmd:description element; recommended practice is to use a JSON object with keys that are parameter names and values that are the necessary parameters.,
OGC:ODS,http://www.opengeospatial.org/standards/ols#ods,OGC OpenLS Directory Service,http://www.opengeospatial.org/standards/ols,srv:serviceType;gmd:protocol;usgin:overlayAPI,,service,@pvgenuchten,gmd:protocol value that indicates CI_OnlineResource URL is for an OGC OpenLS Directory Service ,
OGC:OGS,http://www.opengeospatial.org/standards/ols#ogs,OGC OpenLS Gateway Service,http://www.opengeospatial.org/standards/ols,srv:serviceType;gmd:protocol;usgin:overlayAPI,,service,@pvgenuchten,gmd:protocol value that indicates CI_OnlineResource URL is for an OGC OpenLS Gateway Service,
OGC:OUS,http://www.opengeospatial.org/standards/ols#ous,OGC OpenLS Utility Service,http://www.opengeospatial.org/standards/ols,srv:serviceType;gmd:protocol;usgin:overlayAPI,,service,@pvgenuchten,gmd:protocol value that indicates CI_OnlineResource URL is for an OGC OpenLS Utility Service,
OGC:OPS,http://www.opengeospatial.org/standards/ols#ops,OGC OpenLS Presentation Service,http://www.opengeospatial.org/standards/ols,srv:serviceType;gmd:protocol;usgin:overlayAPI,,service,@pvgenuchten,gmd:protocol value that indicates CI_OnlineResource URL is for an OGC OpenLS Presentation Service ,
OGC:ORS,http://www.opengeospatial.org/standards/ols#ors,OGC OpenLS Route Service,http://www.opengeospatial.org/standards/ols,srv:serviceType;gmd:protocol;usgin:overlayAPI,,service,@pvgenuchten,gmd:protocol value that indicates CI_OnlineResource URL is for an OGC OpenLS Route Service,
OGC:CT,http://www.opengeospatial.org/standards/ct,OGC Coordinate Transformation Service,http://www.opengeospatial.org/standards/ct,srv:serviceType;gmd:protocol;usgin:overlayAPI,,service,@pvgenuchten,gmd:protocol value that indicates CI_OnlineResource URL is for an OGC Coordinate Transformation Service,
OGC:WFS-G,http://www.opengeospatial.org/standards/wfs-g,Gazetteer Service Profile of the Web Feature Service Implementation Specification,http://portal.opengeospatial.org/files/?artifact_id=7175,srv:serviceType;gmd:protocol;usgin:overlayAPI,,service,@pvgenuchten,gmd:protocol value that indicates CI_OnlineResource URL is for an OGC Gazetteer Service Profile of the Web Feature Service Implementation Specification,
OGC:OWC,http://www.opengeospatial.org/standards/owc,OGC OWS Context,http://www.opengeospatial.org/standards/owc,gmd:MD_Format/gmd:name;gmd:applicationProfile,,data,@pvgenuchten,Specifies a fully configured service set which can be exchanged,
OGC:GPKG,http://www.opengeospatial.org/standards/geopackage,OGC Geopackage,http://www.opengeospatial.org/standards/geopackage,gmd:MD_Format/gmd:name;gmd:applicationProfile,,data,@pvgenuchten,SQLite Extension for exchange or direct use of vector geospatial features and / or tile matrix sets of earth images and raster maps at various scales,
OGC:IoT,http://www.ogcnetwork.net/IoT,OGC SensorThings API,http://ogc-iot.github.io/ogc-iot-api,srv:serviceType;gmd:protocol;usgin:overlayAPI,,service,@pvgenuchten,gmd:protocol value that indicates CI_OnlineResource URL is for a SensorThings API,
ESRI:ArcIMS,urn:x-esri:serviceType:ArcIMS,ESRI ArcIMS Service,,srv:serviceType;gmd:protocol;usgin:overlayAPI,Esri Inc.,service,@tomkralidis,gmd:protocol value that indicates CI_OnlineResource URL is for an ArcIMS endpoint. ArcIMS requests are tunneled via HTTP Get URL's,
ESRI:ArcGIS,urn:x-esri:serviceType:ArcGIS,ESRI ArcGIS Service,,srv:serviceType;gmd:protocol;usgin:overlayAPI,Esri Inc.,service,@tomkralidis,gmd:protocol value that indicates CI_OnlineResource URL is for an ESRI Map service endpoint. ESRI REST requests are tunneled via HTTP Get URL's,
ESRI:MPK,http://esriurl.com/mpk.xml,ArcGIS Map Package, http://esriurl.com/mpk.xml,gmd:MD_Format/gmd:name;gmd:applicationProfile,Esri Inc.,data,@mhogeweg,"Example URI for ArcGIS Map Package. Mpk is a file format. A map package contains a map document (.mxd) and the data referenced by the layers it contains, packaged into one convenient, portable file.",
OPeNDAP:OPeNDAP,,OPeNDAP root URL,http://docs.opendap.org/index.php/UserGuideOPeNDAPMessages,srv:serviceType;gmd:protocol;usgin:overlayAPI,,service,@tomkralidis,"Link is the root URL for an OpenDAP endpoint. An OPeNDAP server replies to queries for data and other services in the form of specially formed URLs that start with a root URL, and use a suffix on the root URL and a constraint expression to indicate which service is requested and what the parameters are. Example suffixes are dods, das, dds, nc. OpenDAP defines a syntax for constraint expressions as well.",urn:x-esri:specification:ServiceType:OPeNDAP; urn:x-esri:specification:ServiceType:odp:url
OPeNDAP:Hyrax,,OPeNDAP Hyrax server,http://docs.opendap.org/index.php/Hyrax,srv:serviceType;gmd:protocol;usgin:overlayAPI,,service,@amilan17,"Link is the root URL for an This is the OPeNDAP 4 Data Server, also known as Hyrax. Hyrax is a data server that implements the DAP2 and DAP4 protocols, works with a number of different data formats and supports a wide variety of customization options from tailoring the look of the server's web pages to complex server-side processing operations.",
UNIDATA:NCSS,,NetCDF Subset Service,https://www.unidata.ucar.edu/software/thredds/current/tds/interfaceSpec/NetcdfSubsetService.html,gmd:protocol; usgin:overlayAPI,,service,@tomkralidis,"Link is the root URL for a THREDDS datasets. The NetCDF Subset Service enables subsetting CDM scientific datasets using earth coordinates, such as lat/lon bounding boxes and date ranges; requests are made via HTTP GET with key-value pairs (KVP) for parameters encoded in HTTP URIs.  The resources identified are THREDDS datasets. The resource URIs have a root host name and path, typically something like http://servername:8080/thredds/ncss/, followed by a path that identifies a particular dataset {path/dataset}. A subset of the dataset is considered a view of a resource, specified by query parameters following the character '?' after the dataset path: http://servername:8080/thredds/ncss/{path/dataset}?{subset}. An 'accept' parameter may be used to specify the desired resource representation.",
UNIDATA:CDM,,Common Data Model Remote Web Service,https://www.unidata.ucar.edu/software/thredds/current/netcdf-java/stream/CdmRemote.html,srv:serviceType;gmd:protocol;usgin:overlayAPI,Unidata,service,@tomkralidis,Example,
UNIDATA:CdmRemote,,Common Data Model index subsetting,https://www.unidata.ucar.edu/software/thredds/current/netcdf-java/stream/CdmRemote.html,gmd:protocol; usgin:overlayAPI,Unidata,service,@smrazgs,"CDM Remote provides remote access to UNIDATA Common Data Model (CDM) datasets, using ncstream as the on-the-wire protocol. Client requests are of the form endpoint?query, and the specification defines a vocabulary of valid query parameters. There are two levels of service: 1) CdmRemote provides index subsetting on remote CDM datasets; 2) CdmrFeature provides coordinate subsetting on remote CDM Feature Datasets",
UNIDATA:CdmrFeature,,Common Data Model coordinate subsetting,https://www.unidata.ucar.edu/software/thredds/current/netcdf-java/stream/CdmRemote.html,gmd:protocol; usgin:overlayAPI,Unidata,,@smrazgs,"Link is endpoint URL that provides coordinate subsetting on UNIDATA Common Data Model (CDM) datasets, using ncstream as the on-the-wire protocol. Client requests are of the form endpoint?query, and the specification defines a vocabulary of valid query parameters.",
UNIDATA:THREDDS,http://www.unidata.ucar.edu/namespaces/thredds/InvCatalog/v1.0,THREDDS Catalog,http://www.unidata.ucar.edu/software/thredds/current/tds/catalog/InvCatalogSpec.html,srv:serviceType;gmd:protocol;usgin:overlayAPI,Unidata,service,@kwilcox,"Link is a THREDDS Catalog URL that provides the XML for traversing programmatically. Can be used for datasets and collections of datasets.",
OGC:GML,http://www.opengis.net/gml,OGC Geography Markup Language,,gmd:MD_Format/gmd:name;gmd:applicationProfile,,data,@tomkralidis,Example,
WWW:LINK,http://www.w3.org/TR/xlink/,Web Address (URL),,dct:references/@scheme,,information,@tomkralidis @smrazgs,Indicates that XLINK properties are encoded as key-value pairs in content of a dct:references element to provide a machine actionable link. ,
WWW:WSDL,http://www.w3.org/TR/wsdl,Web Service Description Language XML document describing service operation,http://www.w3.org/TR/wsdl,gmd:applicationProfile,W3C,,@smrazgs,,
WWW:SPARQL:1.1,http://www.w3.org/TR/sparql11-protocol,SPARQL protocol for HTTP,http://www.w3.org/TR/rdf-sparql-query,srv:serviceType;gmd:protocol;usgin:overlayAPI,,service,@pvgenuchten,SPARQL Protocol specifies a means for conveying SPARQL queries and updates to a SPARQL processing service and returning the results via HTTP to the entity that requested them,
OpenSearch1.1,http://www.opensearch.org/Specifications/OpenSearch/1.1#OpenSearch_URL_template_syntax,OpenSearch template,http://www.opensearch.org/Specifications/OpenSearch/1.1#OpenSearch_URL_template_syntax,usgin:template;gmd:applicationProfile,OpenSearch.org,,@smrazgs,use to indicate link is a template conforming to the OpenSearch specification,
OpenSearch1.1:Description,http://www.opensearch.org/Specifications/OpenSearch/1.1#OpenSearch_description_document,OpenSearch description document,http://www.opensearch.org/Specifications/OpenSearch/1.1#OpenSearch_description_document,gmd:applicationProfile,OpenSearch.org,,@smrazgs,indicates a link to get an openSearch description document,
information,,link provides information about resource,,gmd:function,ISO TC211,,@smrazgs,function of link it to http:GET information about resource,
template,http://tools.ietf.org/html/rfc6570,link provides template to access resource,http://tools.ietf.org/html/rfc6570,gmd:function,USGIN,,@smrazgs,Link text is a URI template; applicationProfile attribute value associated with the link should indicate the specification for the template scheme (e.g. OpenSearch1.1).,
download,,link will get resource,,gmd:function,ISO TC211,,@smrazgs,function of link it to http:GET a representation of the resource; the link type attribute value(s) should indicate the MIME types of available representations,
service,,link is service endpoint,,gmd:function,ISO TC211,,@smrazgs,"Link value is the URL of a service endpoint; the link protocol and applicationProfile (and possibly other link properties like overlayAPI, depending on the link attributes profile in use) attribute values should identify the service protocol specification",
order,,link provides form to obtain resource,,gmd:function,ISO TC211,,@smrazgs,link value is URL of web application requiring user interaction to order/request access to the resource,
search,,link provides form for searching resource,,gmd:function,ISO TC211,,@smrazgs,link value is URL of web application requiring user interaction to search/browse/subset the resource.,
esip:CollectionCast,http://commons.esipfed.org/ns/discovery/1.2/collectionCast# ,ESIP collection cast,,gmd:applicationProfile,ESIP,,@smrazgs,,
tilejson:2.0.0,,tile mill map service description,https://github.com/mapbox/tilejson-spec,gmd:applicationProfile,MapBox,,@smrazgs,link is description of a TileMill map service endpoint. Link type would be application/json; function would be information.,
iris:fdsnws-event,http://service.iris.edu/fdsnws/event/1/,IRIS Seismic event service,http://service.iris.edu/fdsnws/event/1,gmd:applicationProfile;usgin:overlayAPI,IRIS,,@smrazgs,Link returns event (earthquake) information from the catalogs submitted to the IRIS DMC,
QuakeML1.2,http://quakeml.org /xmlns /quakeml/1.2,Earthquake markup language,https://quake.ethz.ch/quakeml,gmd:MD_Format/gmd:name;gmd:applicationProfile,quakeml@sed.ethz.ch,,@smrazgs,XML markup language for earthquake hypocenter data,
file,,a file,http://docs.ckan.org/en/ckan-1.8/domain-model-resource.html,gmd:function,OKFN,,@smrazgs,CKAN metadata vocabulary for populating the type attribute on a CKAN resource; indicates that an http  GET of this url should yield a bitstream,
ISO 19115:2003/19139,,ISO 19115 metadata in ISO19139 encoding,,gmd:metadataStandardName,GeoNetwork,,@smrazgs,This is the CharacterString value used by Geonetwork OpenSource to identify ISO metadata record instances; apparently have to assume that its using the 2006 corrigendum with no specific profile conventions.,
ISO-USGIN,,USGIN-profile ISO 19115 metadata,http://repository.usgin.org/uri_gin/usgin/dlio/337,gmd:metadataStandardName,USGIN,,@smrazgs,This is the CharacterString Value mandated by the USGIN profile of ISO19115/19139 for instance documents to self-identify.  ,
http,https://www.ietf.org/rfc/rfc2616,"Hypertext transfer Protocol, v1.1",https://www.ietf.org/rfc/rfc2616.txt,gmd:protocol,IETF,,@smrazgs,Use to indicate gmd:CI_OnlineResource URLs that are simple http links to a target resource representation for download; redundant as the URL prefix 'http:' conveys the same information.,
https,https://tools.ietf.org/html/rfc2818,HTTP over TLS,https://www.ietf.org/rfc/rfc2818.txt,gmd:protocol,IETF,,@amilan17,Use to indicate gmd:CI_OnlineResource URLs that are simple https links to a target resource representation for download; redundant as the URL prefix 'https:' conveys the same information.,
ftp,https://tools.ietf.org/html/rfc959,FILE TRANSFER PROTOCOL (FTP),https://www.ietf.org/rfc/rfc959.txt,gmd:protocol,IETF,,@amilan17,Use to indicate gmd:CI_OnlineResource URLs that are simple ftp links to a target resource representation for download; redundant as the URL prefix 'ftp:' conveys the same information.,
IETF:GeoJSON,http://geojson.org,GeoJSON,https://datatracker.ietf.org/doc/draft-butler-geojson,gmd:MD_Format/gmd:name;gmd:applicationProfile,,data,@pvgenuchten,GeoJSON is a geospatial data interchange format based on JavaScript Object Notation (JSON),
GIT,http://git-scm.com/,GIT,http://git-scm.com/book/commands,srv:serviceType;gmd:protocol;usgin:overlayAPI,,service,@pvgenuchten,gmd:protocol value that indicates CI_OnlineResource URL is for a GIT repository,
OKFN:datapackage,http://data.okfn.org/doc/data-package,OKFN Data Package,http://dataprotocols.org/data-packages,gmd:MD_Format/gmd:name;gmd:applicationProfile,,data,@pvgenuchten,A Data Package is a simple way of packaging up data,
boundless:geogig,http://geogig.org,Boundless GeoGig,http://geogig.org/docs/interaction/web-api.html,srv:serviceType;gmd:protocol;usgin:overlayAPI,Boundless,service,@pvgenuchten,gmd:protocol value that indicates CI_OnlineResource URL is for a GeoGig REST API,
OASIS:OData:4.0,http://docs.oasis-open.org/odata/odata/v4.0,OData v4.0,http://docs.oasis-open.org/odata/odata/v4.0/odata-v4.0-part1-protocol.html,srv:serviceType;gmd:protocol;usgin:overlayAPI,,service,@pvgenuchten,gmd:protocol value that indicates CI_OnlineResource URL is for an OData JSON endpoint,
maxogden:dat,http://dat-data.com,dat REST API,https://github.com/maxogden/dat/blob/master/docs/rest-api.md,srv:serviceType;gmd:protocol;usgin:overlayAPI,,service,@pvgenuchten,gmd:protocol value that indicates CI_OnlineResource URL is for a dat REST API,
geoserver:rest,http://docs.geoserver.org/latest/en/user/rest,GeoServer REST configuration API,http://docs.geoserver.org/latest/en/user/rest,srv:serviceType;gmd:protocol;usgin:overlayAPI,,service,@pvgenuchten,gmd:protocol value that indicates CI_OnlineResource URL is for a Geoserver rest API to configure featuretypes in Geoserver (and mapserver) remotely,
google:protocol-buffers,https://developers.google.com/protocol-buffers,Google Protocol Buffers,https://developers.google.com/protocol-buffers,gmd:MD_Format/gmd:name;gmd:applicationProfile,Google,data,@pvgenuchten,Googles mechanism for serializing structured data,
google:fusion-tables,http://google.com/fusiontables,Google Fusion Tables,https://developers.google.com/fusiontables,gmd:MD_Format/gmd:name;gmd:applicationProfile,Google,data,@pvgenuchten,Google mechanism for interating with online data tables,
NOAA:LAS,http://ferret.pmel.noaa.gov/LAS,Live Access Server,http://ferret.pmel.noaa.gov/LAS/documentation/developer-documentation/the-xml-messages-used-by-las,srv:serviceType;gmd:protocol;usgin:overlayAPI,,service,@pvgenuchten,gmd:protocol value that indicates CI_OnlineResource URL is a LAS endpoint,
OSM,http://wiki.openstreetmap.org/wiki/API,Open Street Map API,http://wiki.openstreetmap.org/wiki/API,srv:serviceType;gmd:protocol;usgin:overlayAPI,,service,@pvgenuchten,gmd:protocol value that indicates CI_OnlineResource URL is for a OSM APIfor fetching and saving raw geodata from/to an OpenStreetMap database ,
ERDDAP:griddap,http://coastwatch.pfeg.noaa.gov/erddap/griddap/documentation.html,ERDDAP Data Service for Gridded Datasets,http://coastwatch.pfeg.noaa.gov/erddap/griddap/documentation.html,srv:serviceType;gmd:protocol;usgin:overlayAPI,@BobSimons,service,@BobSimons,"griddap lets you request a data subset, graph, or map from a gridded dataset (for example, sea surface temperature data from a satellite), via a specially formed URL. griddap uses the OPeNDAP (external link) Data Access Protocol (DAP) (external link) and its projection constraints (external link).  Link is the root URL for an ERDDAP griddap service endpoint. The service responds to OPeNDAP requests and related ERDDAP-specific requests to a gridded dataset. A request starts with this root URL, adds a file type extension, and sometimes a constraint expression to specify a subset of data. Example file type extensions which don't require a constraint are .das, .dds, .html, and .graph. Example file type extensions which do require a constraint are .dods, .nc, .mat, .json, and .htmlTable. Full documentation for ERDDAP API at http://coastwatch.pfeg.noaa.gov/erddap/rest.html",
ERDDAP:tabledap,http://coastwatch.pfeg.noaa.gov/erddap/tabledap/documentation.html,ERDDAP Data Service for Tabular Datasets,http://coastwatch.pfeg.noaa.gov/erddap/tabledap/documentation.html,srv:serviceType;gmd:protocol;usgin:overlayAPI,@BobSimons,service,@BobSimons,"Tabledap lets you request a data subset, a graph, or a map from a tabular dataset (for example, buoy data), via a specially formed URL. tabledap uses the OPeNDAP (external link) Data Access Protocol (DAP) (external link) and its selection constraints (external link).  Link is the root URL for an ERDDAP tabledap service endpoint. The service responds to OPeNDAP requests and related ERDDAP-specific requests to a tabular (sequence) dataset. A request starts with this root URL, adds a file type extension, and sometimes a constraint expression to specify a subset of data. Example file type extensions which don't require a constraint are .das, .dds, .html, and .graph. Example file type extensions which do require a constraint are .dods, .nc, .mat, .json, and .htmlTable.  Full documentation for ERDDAP API at http://coastwatch.pfeg.noaa.gov/erddap/rest.html",
OASIS:AMQP,https://amqp.org,Advanced Message Queuing Protocol,https://amqp.org,gmd:protocol,,service,@tomkralidis,gmd:protocol value that indicates CI_OnlineResource URL is for an AMQP broker,
